{"checkpoints":[{"length":254,"sha256":"053f01e060e18087a1a906756bf381f9ad5b73b8c9801ebaefa52f976f2b3aaf"}],"format":"tensorfs.repo/1","name":"Conformance/core","releases":[{"revision":3,"tree":{"length":369,"sha256":"eeb3d886fb8302f6ae6b76e4c09841da99717fc8df30b8e45a731754d352c47f"},"version":"1"},{"tree":{"length":369,"sha256":"881a42fec33b8788c65d43525f97919b549d53b68478d2f4245ecfdf8e27eaed"},"version":"2","yanked":true}]}